title,date,content,from
中国证监会印发2025年度立法工作计划,2025-05-09,"为深入贯彻党的二十届三中全会和中央经济工作会议精神，落实新“国九条”部署要求，进一步做好2025年证券期货监管规章制定等立法工作，加强资本市场法律制度建设，中国证监会结合监管工作实践和市场各方关注，于近日制定了2025年度立法工作计划，对全年的立法工作做了总体部署。中国证监会将按照立法工作计划积极推动各项制度文件出台。
纳入中国证监会2025年度立法工作计划的规章项目共有19件，包括“力争年内出台的重点项目”8件以及“需要抓紧研究、择机出台的项目”11件，立法的重心是加强资本市场重点领域监管，维护市场平稳健康发展，切实保护广大中小投资者合法权益。
一是强化对资本市场相关行为的监管，切实维护公开、公平、公正的市场秩序。其中，“力争年内出台的重点项目”5件，包括制定《证券基金投资咨询业务管理办法》《衍生品交易监督管理办法》；修订《证券发行与承销管理办法》（已公布）、《上市公司信息披露管理办法》（已公布）、《上市公司重大资产重组管理办法》。“需要抓紧研究、择机出台的项目”3件，包括制定《私募投资基金信息提供管理办法》和修订《证券投资基金托管业务管理办法》《公开募集证券投资基金运作管理办法》。
二是加强对资本市场相关主体的规范，进一步夯实资本市场发展基础。其中，“力争年内出台的重点项目”1件，包括修订《期货公司监督管理办法》。“需要抓紧研究、择机出台的项目”3件，包括制定《公开募集不动产投资基金监督管理暂行办法》和修订《期货从业人员管理办法》《证券期货基金经营机构信息科技管理办法》。
三是深入推进依法行政，进一步提高资本市场监管执法效能。其中，“力争年内出台的重点项目”2件，包括制定《中国证监会行政处罚裁量基本规则》（已公布）；修订《中国证监会派出机构监管职责规定》（已公布）。“需要抓紧研究、择机出台的项目”5件，包括制定《证券期货市场监督管理措施实施办法》《证券期货行政处罚案件违法所得认定规则》；修订《证券融资融券业务管理办法》《转融通业务监督管理试行办法》《证券期货市场诚信监督管理办法》。
除了上述规章项目外，2025年中国证监会还将配合国务院有关部门做好《证券公司监督管理条例》《上市公司监督管理条例》《不动产投资基金管理条例》等行政法规的制定、修订工作；组织开展《证券投资基金法》实施的评估工作，推动《证券投资基金法》的修订完善；配合有关司法机关做好证券期货领域相关司法解释制定、修订工作。
在执行2025年度立法工作计划中，中国证监会将继续深入广泛地听取市场和社会各方的意见建议，不断提高资本市场监管制度规则的立法水平，努力为资本市场高质量发展提供更好的制度支持和保障。",证监会
中国人民银行 中国证监会联合发布关于支持发行科技创新债券有关事宜的公告,2025-05-07,"党的二十届三中全会明确提出，要加快多层次债券市场建设，构建同科技创新相适应的科技金融体制。近日，中国人民银行、中国证监会联合发布关于支持发行科技创新债券有关事宜的公告（中国人民银行 中国证监会公告〔2025〕8号，以下简称《公告》）。《公告》是落实党的二十届三中全会精神的重要举措，有利于拓宽科技创新企业融资渠道，引导债券市场资金投早、投小、投长期、投硬科技，激发科技创新动力和市场活力，助力培育新质生产力。
《公告》从丰富科技创新债券产品体系和完善科技创新债券配套支持机制等方面，对支持科技创新债券发行提出若干举措。主要包括：一是支持金融机构、科技型企业、私募股权投资机构和创业投资机构（以下简称股权投资机构）发行科技创新债券。科技创新债券含公司债券、企业债券、非金融企业债务融资工具等。二是发行人可灵活设置债券条款，鼓励发行长期限债券，更好匹配科技创新领域资金使用特点和需求。三是为科技创新债券融资提供便利，优化债券发行管理，简化信息披露，创新信用评级体系，完善风险分散分担机制等。四是将科技创新债券纳入金融机构科技金融服务质效评估。五是鼓励有条件的地方提供贴息、担保等支持措施。下一步，中国人民银行、中国证监会将持续完善科技创新债券配套支持机制，引导债券资金更加高效、便捷、低成本投向科技创新领域，提升债券市场服务科技创新能力。",证监会
中国证监会印发《推动公募基金高质量发展行动方案》,2025-05-07,"落实2024年9月26日中央政治局会议“稳步推进公募基金改革”决策部署，中国证监会于近日公开印发《推动公募基金高质量发展行动方案》。
行动方案坚持党对公募基金行业的全面领导，突出行业发展的政治性与人民性，坚持以投资者为本的发展理念，以强监管、防风险、促高质量发展为主线，探索建立适合中国国情、市情的公募基金发展新模式；坚持问题导向、目标导向，提出一系列回应市场和社会关切的改革措施，着力督促基金公司、基金销售机构等行业机构从“重规模”向“重回报”转变，形成行业高质量发展的“拐点”。行动方案共提出25条举措，重点如下：
一、优化主动管理权益类基金收费模式。对主动管理权益类基金，推行与基金业绩表现挂钩的浮动管理费率收取模式，对于符合一定持有期要求的投资者，根据其持有期间产品业绩表现适用差异化的管理费率。业绩明显低于比较基准的，须少收管理费，有力扭转基金公司“旱涝保收”的现象。
二、强化基金公司与投资者的利益绑定。全面建立以基金投资收益为核心的行业考核评价体系，将业绩比较基准对比、基金利润率等直接关乎投资者利益的指标引入考核体系，相应降低产品管理规模排名、基金公司收入利润等指标的考核权重。提高基金公司高管、基金经理跟投本公司管理产品的比例和锁定期要求。督促基金公司建立健全与基金投资收益挂钩的薪酬管理制度，对产品中长期业绩差的基金经理，要求其绩效薪酬应当明显下降，更好体现与投资者的“同甘共苦”。
三、提升行业服务投资者的能力。引导基金公司、基金销售机构围绕投资者最佳利益，全面优化投资研究、产品设计、风险管理、市场推广等资源配置，践行长期投资、价值投资、理性投资，努力给投资者带来更优回报。抓紧出台公募基金投资顾问管理规定，促进基金投顾业务规范发展，为投资者提供适配其特点和需求的组合投资服务。加快推出机构投资者直销服务平台，便利各类机构投资者参与基金投资。
四、提高公募基金权益投资的规模和稳定性。优化基金注册安排，推出更多场内外指数基金和中低波动含权型产品，促进权益类基金创新发展。强化基金产品业绩比较基准的约束力，充分发挥其体现产品定位、衡量产品业绩的作用，对基金投资业绩全面实施三年以上长周期考核，提升公募基金投资行为稳定性，促进资本市场投融资平衡发展。
五、一体推进强监管防风险促高质量发展。完善监管制度，丰富执法手段，将“长牙带刺”落到实处。提升基金公司治理水平，督促大股东、董事会、经营层归位尽责。完善行业多层次流动性风险防控机制，持续提高行业合规水平。提升行业声誉管理能力，唱响经济光明论，充分发挥引导和塑造预期的积极作用。大力弘扬和践行“五要五不”的中国特色金融文化，加快建设一流投资机构。
下一步，中国证监会将平稳有序推进各项政策举措落实落地，促进行业持续提升服务居民财富管理、服务资本市场改革发展稳定、服务实体经济和国家战略的能力。",证监会
